{
  "format": "tiny-v2-trainer-state-v1",
  "completed_global_step": 50,
  "requested_final_step": 50,
  "eval_every": 25,
  "batch_size": 8,
  "seed": 17,
  "learning_rate": 0.0003,
  "optimizer": {
    "name": "AdamW",
    "betas": [
      0.9,
      0.999
    ],
    "eps": 1e-08,
    "weight_decay": 0.01
  },
  "parameter_steps": {
    "tokens.weight": 50,
    "positions.weight": 50
  },
  "incumbent": {
    "checkpoint_id": "10101010-1010-4010-8010-101010101010",
    "validation_nll_token": 4.9,
    "step": 50
  },
  "dataset_bindings": [
    {
      "split": "train",
      "dataset_id": "14141414-1414-4414-8414-141414141414",
      "sha256": "dddddddddddddddddddddddddddddddddddddddddddddddddddddddddddddddd"
    },
    {
      "split": "validation",
      "dataset_id": "14141414-1414-4414-8414-141414141414",
      "sha256": "eeeeeeeeeeeeeeeeeeeeeeeeeeeeeeeeeeeeeeeeeeeeeeeeeeeeeeeeeeeeeeee"
    }
  ],
  "tokenizer_sha256": "cccccccccccccccccccccccccccccccccccccccccccccccccccccccccccccccc",
  "architecture_profile_id": "tiny-v2-standard-v1",
  "runtime_profile": "win-cpu",
  "device": "cpu",
  "dependency_lock_sha256": "ffffffffffffffffffffffffffffffffffffffffffffffffffffffffffffffff"
}
